{
  "$schema": "http://json-schema.org/draft-07/schema#",
  "title": "grammy_nominations_db.first_time_nominees",
  "description": "Formal MongoDB schema for first_time_nominees collection in grammy_nominations_db",
  "type": "object",
  "required": [
    "first_nom_id",
    "nomination_id",
    "creator_id",
    "debut_ceremony_edition",
    "breakout_work_id",
    "best_new_artist_nominated",
    "age_at_debut_nomination",
    "prior_uncredited_appearances",
    "commercial_breakout_tier",
    "career_inception_year"
  ],
  "properties": {
    "first_nom_id": {
      "type": "string",
      "description": "Domain attribute: first_nom_id"
    },
    "nomination_id": {
      "type": "string",
      "description": "Domain attribute: nomination_id"
    },
    "creator_id": {
      "type": "string",
      "description": "Domain attribute: creator_id"
    },
    "debut_ceremony_edition": {
      "type": "integer",
      "description": "Domain attribute: debut_ceremony_edition"
    },
    "breakout_work_id": {
      "type": "string",
      "description": "Domain attribute: breakout_work_id"
    },
    "best_new_artist_nominated": {
      "type": "boolean",
      "description": "Domain attribute: best_new_artist_nominated"
    },
    "age_at_debut_nomination": {
      "type": "integer",
      "description": "Domain attribute: age_at_debut_nomination"
    },
    "prior_uncredited_appearances": {
      "type": "integer",
      "description": "Domain attribute: prior_uncredited_appearances"
    },
    "commercial_breakout_tier": {
      "type": "string",
      "description": "Domain attribute: commercial_breakout_tier"
    },
    "career_inception_year": {
      "type": "integer",
      "description": "Domain attribute: career_inception_year"
    }
  },
  "additionalProperties": true
}