[
  {
    "first_nom_id": "FIRST_NOM_001",
    "nomination_id": "NOM_001_RECORD_OF__0000",
    "creator_id": "CRT_NEL_BLU_DIPINTO",
    "debut_ceremony_edition": 1,
    "breakout_work_id": "WRK_NEL_BLU_DIPINTO_DI_BLU_VOLARE_0000",
    "best_new_artist_nominated": true,
    "age_at_debut_nomination": 24,
    "prior_uncredited_appearances": 0,
    "commercial_breakout_tier": "Global Breakthrough",
    "career_inception_year": 1955
  },
  {
    "first_nom_id": "FIRST_NOM_002",
    "nomination_id": "NOM_001_ALBUM_OF_T_0001",
    "creator_id": "CRT_HENRY_MANCINI",
    "debut_ceremony_edition": 2,
    "breakout_work_id": "WRK_THE_MUSIC_FROM_PETER_GUNN_0001",
    "best_new_artist_nominated": false,
    "age_at_debut_nomination": 25,
    "prior_uncredited_appearances": 0,
    "commercial_breakout_tier": "Global Breakthrough",
    "career_inception_year": 1956
  },
  {
    "first_nom_id": "FIRST_NOM_003",
    "nomination_id": "NOM_001_SONG_OF_TH_0002",
    "creator_id": "CRT_NEL_BLU_DIPINTO",
    "debut_ceremony_edition": 3,
    "breakout_work_id": "WRK_NEL_BLU_DIPINTO_DI_BLU_VOLARE_0002",
    "best_new_artist_nominated": true,
    "age_at_debut_nomination": 26,
    "prior_uncredited_appearances": 0,
    "commercial_breakout_tier": "Global Breakthrough",
    "career_inception_year": 1957
  },
  {
    "first_nom_id": "FIRST_NOM_004",
    "nomination_id": "NOM_001_BEST_VOCAL_0003",
    "creator_id": "CRT_ELLA_FITZGERALD",
    "debut_ceremony_edition": 4,
    "breakout_work_id": "WRK_ELLA_FITZGERALD_SINGS_THE_IRVI_0003",
    "best_new_artist_nominated": false,
    "age_at_debut_nomination": 27,
    "prior_uncredited_appearances": 0,
    "commercial_breakout_tier": "Global Breakthrough",
    "career_inception_year": 1958
  },
  {
    "first_nom_id": "FIRST_NOM_005",
    "nomination_id": "NOM_001_BEST_VOCAL_0004",
    "creator_id": "CRT_CATCH_A_FALLING",
    "debut_ceremony_edition": 5,
    "breakout_work_id": "WRK_CATCH_A_FALLING_STAR_0004",
    "best_new_artist_nominated": true,
    "age_at_debut_nomination": 28,
    "prior_uncredited_appearances": 0,
    "commercial_breakout_tier": "Global Breakthrough",
    "career_inception_year": 1959
  },
  {
    "first_nom_id": "FIRST_NOM_006",
    "nomination_id": "NOM_001_BEST_PERFO_0005",
    "creator_id": "CRT_BILLY_MAY_S_BIG",
    "debut_ceremony_edition": 6,
    "breakout_work_id": "WRK_BILLY_MAY_S_BIG_FAT_BRASS_0005",
    "best_new_artist_nominated": false,
    "age_at_debut_nomination": 29,
    "prior_uncredited_appearances": 0,
    "commercial_breakout_tier": "Global Breakthrough",
    "career_inception_year": 1960
  },
  {
    "first_nom_id": "FIRST_NOM_007",
    "nomination_id": "NOM_001_BEST_PERFO_0006",
    "creator_id": "CRT_BASIE",
    "debut_ceremony_edition": 7,
    "breakout_work_id": "WRK_BASIE_0006",
    "best_new_artist_nominated": true,
    "age_at_debut_nomination": 30,
    "prior_uncredited_appearances": 0,
    "commercial_breakout_tier": "Global Breakthrough",
    "career_inception_year": 1961
  },
  {
    "first_nom_id": "FIRST_NOM_008",
    "nomination_id": "NOM_001_BEST_PERFO_0007",
    "creator_id": "CRT_THAT_OLD_BLACK_",
    "debut_ceremony_edition": 8,
    "breakout_work_id": "WRK_THAT_OLD_BLACK_MAGIC_0007",
    "best_new_artist_nominated": false,
    "age_at_debut_nomination": 31,
    "prior_uncredited_appearances": 0,
    "commercial_breakout_tier": "Global Breakthrough",
    "career_inception_year": 1962
  },
  {
    "first_nom_id": "FIRST_NOM_009",
    "nomination_id": "NOM_001_BEST_JAZZ__0008",
    "creator_id": "CRT_ELLA_FITZGERALD",
    "debut_ceremony_edition": 9,
    "breakout_work_id": "WRK_ELLA_FITZGERALD_SINGS_THE_DUKE_0008",
    "best_new_artist_nominated": true,
    "age_at_debut_nomination": 32,
    "prior_uncredited_appearances": 0,
    "commercial_breakout_tier": "Global Breakthrough",
    "career_inception_year": 1963
  },
  {
    "first_nom_id": "FIRST_NOM_010",
    "nomination_id": "NOM_001_BEST_JAZZ__0009",
    "creator_id": "CRT_BASIE",
    "debut_ceremony_edition": 10,
    "breakout_work_id": "WRK_BASIE_0009",
    "best_new_artist_nominated": false,
    "age_at_debut_nomination": 33,
    "prior_uncredited_appearances": 0,
    "commercial_breakout_tier": "Global Breakthrough",
    "career_inception_year": 1964
  },
  {
    "first_nom_id": "FIRST_NOM_011",
    "nomination_id": "NOM_001_BEST_COMED_0010",
    "creator_id": "CRT_THE_CHIPMUNK_SO",
    "debut_ceremony_edition": 11,
    "breakout_work_id": "WRK_THE_CHIPMUNK_SONG_0010",
    "best_new_artist_nominated": true,
    "age_at_debut_nomination": 34,
    "prior_uncredited_appearances": 0,
    "commercial_breakout_tier": "Global Breakthrough",
    "career_inception_year": 1965
  },
  {
    "first_nom_id": "FIRST_NOM_012",
    "nomination_id": "NOM_001_BEST_COUNT_0011",
    "creator_id": "CRT_TOM_DOOLEY",
    "debut_ceremony_edition": 12,
    "breakout_work_id": "WRK_TOM_DOOLEY_0011",
    "best_new_artist_nominated": false,
    "age_at_debut_nomination": 35,
    "prior_uncredited_appearances": 0,
    "commercial_breakout_tier": "Global Breakthrough",
    "career_inception_year": 1966
  },
  {
    "first_nom_id": "FIRST_NOM_013",
    "nomination_id": "NOM_001_BEST_RHYTH_0012",
    "creator_id": "CRT_TEQUILA",
    "debut_ceremony_edition": 13,
    "breakout_work_id": "WRK_TEQUILA_0012",
    "best_new_artist_nominated": true,
    "age_at_debut_nomination": 36,
    "prior_uncredited_appearances": 0,
    "commercial_breakout_tier": "Global Breakthrough",
    "career_inception_year": 1967
  },
  {
    "first_nom_id": "FIRST_NOM_014",
    "nomination_id": "NOM_001_BEST_ARRAN_0013",
    "creator_id": "CRT_HENRY_MANCINI",
    "debut_ceremony_edition": 14,
    "breakout_work_id": "WRK_THE_MUSIC_FROM_PETER_GUNN_0013",
    "best_new_artist_nominated": false,
    "age_at_debut_nomination": 37,
    "prior_uncredited_appearances": 0,
    "commercial_breakout_tier": "Global Breakthrough",
    "career_inception_year": 1968
  },
  {
    "first_nom_id": "FIRST_NOM_015",
    "nomination_id": "NOM_001_BEST_ENGIN_0014",
    "creator_id": "CRT_DUETS_WITH_A_SP",
    "debut_ceremony_edition": 15,
    "breakout_work_id": "WRK_DUETS_WITH_A_SPANISH_GUITAR_0014",
    "best_new_artist_nominated": true,
    "age_at_debut_nomination": 38,
    "prior_uncredited_appearances": 0,
    "commercial_breakout_tier": "Global Breakthrough",
    "career_inception_year": 1969
  },
  {
    "first_nom_id": "FIRST_NOM_016",
    "nomination_id": "NOM_001_BEST_ENGIN_0015",
    "creator_id": "CRT_THE_CHIPMUNK_SO",
    "debut_ceremony_edition": 16,
    "breakout_work_id": "WRK_THE_CHIPMUNK_SONG_0015",
    "best_new_artist_nominated": false,
    "age_at_debut_nomination": 24,
    "prior_uncredited_appearances": 0,
    "commercial_breakout_tier": "Global Breakthrough",
    "career_inception_year": 1970
  },
  {
    "first_nom_id": "FIRST_NOM_017",
    "nomination_id": "NOM_001_BEST_ALBUM_0016",
    "creator_id": "CRT_FRANK_SINATRA",
    "debut_ceremony_edition": 17,
    "breakout_work_id": "WRK_ONLY_THE_LONELY_0016",
    "best_new_artist_nominated": true,
    "age_at_debut_nomination": 25,
    "prior_uncredited_appearances": 0,
    "commercial_breakout_tier": "Global Breakthrough",
    "career_inception_year": 1971
  },
  {
    "first_nom_id": "FIRST_NOM_018",
    "nomination_id": "NOM_001_BEST_MUSIC_0017",
    "creator_id": "CRT_CROSS_COUNTRY_S",
    "debut_ceremony_edition": 18,
    "breakout_work_id": "WRK_CROSS_COUNTRY_SUITE_0017",
    "best_new_artist_nominated": false,
    "age_at_debut_nomination": 26,
    "prior_uncredited_appearances": 0,
    "commercial_breakout_tier": "Global Breakthrough",
    "career_inception_year": 1972
  },
  {
    "first_nom_id": "FIRST_NOM_019",
    "nomination_id": "NOM_001_BEST_ORIGI_0018",
    "creator_id": "CRT_THE_MUSIC_MAN",
    "debut_ceremony_edition": 19,
    "breakout_work_id": "WRK_THE_MUSIC_MAN_0018",
    "best_new_artist_nominated": true,
    "age_at_debut_nomination": 27,
    "prior_uncredited_appearances": 0,
    "commercial_breakout_tier": "Global Breakthrough",
    "career_inception_year": 1973
  },
  {
    "first_nom_id": "FIRST_NOM_020",
    "nomination_id": "NOM_001_BEST_SOUND_0019",
    "creator_id": "CRT_ANDR_PREVIN",
    "debut_ceremony_edition": 20,
    "breakout_work_id": "WRK_GIGI_0019",
    "best_new_artist_nominated": false,
    "age_at_debut_nomination": 28,
    "prior_uncredited_appearances": 0,
    "commercial_breakout_tier": "Global Breakthrough",
    "career_inception_year": 1974
  },
  {
    "first_nom_id": "FIRST_NOM_021",
    "nomination_id": "NOM_001_BEST_PERFO_0020",
    "creator_id": "CRT_THE_BEST_OF_THE",
    "debut_ceremony_edition": 21,
    "breakout_work_id": "WRK_THE_BEST_OF_THE_STAN_FREBERG_S_0020",
    "best_new_artist_nominated": true,
    "age_at_debut_nomination": 29,
    "prior_uncredited_appearances": 0,
    "commercial_breakout_tier": "Global Breakthrough",
    "career_inception_year": 1975
  },
  {
    "first_nom_id": "FIRST_NOM_022",
    "nomination_id": "NOM_001_BEST_RECOR_0021",
    "creator_id": "CRT_THE_CHIPMUNK_SO",
    "debut_ceremony_edition": 22,
    "breakout_work_id": "WRK_THE_CHIPMUNK_SONG_0021",
    "best_new_artist_nominated": false,
    "age_at_debut_nomination": 30,
    "prior_uncredited_appearances": 0,
    "commercial_breakout_tier": "Global Breakthrough",
    "career_inception_year": 1976
  },
  {
    "first_nom_id": "FIRST_NOM_023",
    "nomination_id": "NOM_001_BEST_CLASS_0022",
    "creator_id": "CRT_GAIETE_PARISIEN",
    "debut_ceremony_edition": 23,
    "breakout_work_id": "WRK_GAIETE_PARISIENNE_0022",
    "best_new_artist_nominated": true,
    "age_at_debut_nomination": 31,
    "prior_uncredited_appearances": 0,
    "commercial_breakout_tier": "Global Breakthrough",
    "career_inception_year": 1977
  },
  {
    "first_nom_id": "FIRST_NOM_024",
    "nomination_id": "NOM_001_BEST_CLASS_0023",
    "creator_id": "CRT_TCHAIKOVSKY_PIA",
    "debut_ceremony_edition": 24,